{
  "version": "1.0.0",
  "role": "developer",
  "specialization": "general",
  "metadata": {
    "title": {
      "en": "Beginner Developer Skills",
      "zh": "初级开发者技能"
    },
    "description": {
      "en": "Essential skills for new software developers starting their journey",
      "zh": "新手软件开发者入门必备技能"
    },
    "lastUpdated": "2026-04-01"
  },
  "skills": [
    {
      "id": "programming-fundamentals",
      "name": {
        "en": "Programming Fundamentals",
        "zh": "编程基础"
      },
      "level": "beginner",
      "description": {
        "en": "Core programming concepts and syntax",
        "zh": "核心编程概念和语法"
      },
      "items": [
        {
          "id": "basic-syntax",
          "name": {
            "en": "Basic Syntax and Semantics",
            "zh": "基本语法和语义"
          },
          "description": {
            "en": "Understanding variables, constants, operators, and basic language constructs",
            "zh": "理解变量、常量、运算符和基本语言结构"
          },
          "importance": "required",
          "tags": ["fundamentals", "syntax"]
        },
        {
          "id": "data-types",
          "name": {
            "en": "Data Types and Variables",
            "zh": "数据类型和变量"
          },
          "description": {
            "en": "Declaring and using primitive data types (numbers, strings, booleans)",
            "zh": "声明和使用基本数据类型（数字、字符串、布尔值）"
          },
          "importance": "required",
          "tags": ["fundamentals", "variables"]
        },
        {
          "id": "control-structures",
          "name": {
            "en": "Control Structures",
            "zh": "控制结构"
          },
          "description": {
            "en": "Using if/else, switch/case, and ternary operators for conditional logic",
            "zh": "使用 if/else、switch/case 和三目运算符进行条件逻辑"
          },
          "importance": "required",
          "tags": ["fundamentals", "logic"]
        },
        {
          "id": "loops",
          "name": {
            "en": "Loops",
            "zh": "循环"
          },
          "description": {
            "en": "Implementing for, while, and do-while loops to repeat operations",
            "zh": "实现 for、while 和 do-while 循环来重复操作"
          },
          "importance": "required",
          "tags": ["fundamentals", "iteration"]
        },
        {
          "id": "functions",
          "name": {
            "en": "Functions and Methods",
            "zh": "函数和方法"
          },
          "description": {
            "en": "Creating reusable code blocks with parameters and return values",
            "zh": "创建带有参数和返回值的可重用代码块"
          },
          "importance": "required",
          "tags": ["fundamentals", "functions"]
        },
        {
          "id": "basic-data-structures",
          "name": {
            "en": "Basic Data Structures",
            "zh": "基本数据结构"
          },
          "description": {
            "en": "Using arrays/lists and dictionaries/maps to store collections of data",
            "zh": "使用数组/列表和字典/映射来存储数据集合"
          },
          "importance": "required",
          "tags": ["fundamentals", "data-structures"]
        },
        {
          "id": "exception-handling",
          "name": {
            "en": "Exception Handling",
            "zh": "异常处理"
          },
          "description": {
            "en": "Managing errors gracefully with try/catch blocks",
            "zh": "使用 try/catch 块优雅地处理错误"
          },
          "importance": "recommended",
          "tags": ["fundamentals", "error-handling"]
        }
      ]
    },
    {
      "id": "development-environment",
      "name": {
        "en": "Development Environment",
        "zh": "开发环境"
      },
      "level": "beginner",
      "description": {
        "en": "Tools and setup for efficient development",
        "zh": "高效开发的工具和设置"
      },
      "items": [
        {
          "id": "ide-setup",
          "name": {
            "en": "Text Editors/IDE Setup",
            "zh": "文本编辑器/IDE 设置"
          },
          "description": {
            "en": "Configuring and using a code editor (VSCode, IntelliJ, etc.)",
            "zh": "配置和使用代码编辑器（VSCode、IntelliJ 等）"
          },
          "importance": "required",
          "tags": ["tools", "ide"]
        },
        {
          "id": "command-line",
          "name": {
            "en": "Command Line Interface",
            "zh": "命令行界面"
          },
          "description": {
            "en": "Navigating and executing commands in terminal/command prompt",
            "zh": "在终端/命令提示符中导航和执行命令"
          },
          "importance": "required",
          "tags": ["tools", "cli"]
        },
        {
          "id": "package-managers",
          "name": {
            "en": "Package Managers",
            "zh": "包管理器"
          },
          "description": {
            "en": "Installing and managing dependencies with npm, pip, Maven, etc.",
            "zh": "使用 npm、pip、Maven 等安装和管理依赖"
          },
          "importance": "required",
          "tags": ["tools", "dependencies"]
        },
        {
          "id": "debugging-basics",
          "name": {
            "en": "Basic Debugging",
            "zh": "基本调试"
          },
          "description": {
            "en": "Using debugger tools to identify and fix issues in code",
            "zh": "使用调试工具识别和修复代码中的问题"
          },
          "importance": "recommended",
          "tags": ["tools", "debugging"]
        }
      ]
    },
    {
      "id": "version-control",
      "name": {
        "en": "Version Control",
        "zh": "版本控制"
      },
      "level": "beginner",
      "description": {
        "en": "Managing code changes with Git",
        "zh": "使用 Git 管理代码变更"
      },
      "items": [
        {
          "id": "git-basics",
          "name": {
            "en": "Git Basics",
            "zh": "Git 基础"
          },
          "description": {
            "en": "Understanding git init, git clone, git status commands",
            "zh": "理解 git init、git clone、git status 命令"
          },
          "importance": "required",
          "tags": ["git", "vcs"]
        },
        {
          "id": "git-commits",
          "name": {
            "en": "Committing Changes",
            "zh": "提交更改"
          },
          "description": {
            "en": "Creating meaningful commits with git commit",
            "zh": "使用 git commit 创建有意义的提交"
          },
          "importance": "required",
          "tags": ["git", "commits"]
        },
        {
          "id": "git-branching",
          "name": {
            "en": "Branching Fundamentals",
            "zh": "分支基础"
          },
          "description": {
            "en": "Creating, switching, and deleting branches with git branch",
            "zh": "使用 git branch 创建、切换和删除分支"
          },
          "importance": "required",
          "tags": ["git", "branching"]
        },
        {
          "id": "git-remote",
          "name": {
            "en": "Remote Repositories",
            "zh": "远程仓库"
          },
          "description": {
            "en": "Connecting local repositories to remote hosts (GitHub, GitLab)",
            "zh": "将本地仓库连接到远程主机（GitHub、GitLab）"
          },
          "importance": "required",
          "tags": ["git", "remote"]
        }
      ]
    }
  ]
}
