{
  "version": "1.0.0",
  "role": "ops",
  "specialization": "devops",
  "metadata": {
    "title": {
      "en": "Beginner DevOps / Operations Skills",
      "zh": "初级运维 / DevOps 技能"
    },
    "description": {
      "en": "Essential skills for beginners in DevOps and operations engineering",
      "zh": "DevOps 与运维工程入门必备技能"
    },
    "lastUpdated": "2026-04-03"
  },
  "skills": [
    {
      "id": "container-basics",
      "name": {
        "en": "Container Basics",
        "zh": "容器基础"
      },
      "level": "beginner",
      "description": {
        "en": "Fundamental Docker operations and container concepts",
        "zh": "Docker 基础操作与容器概念"
      },
      "items": [
        {
          "id": "docker-essentials",
          "name": {
            "en": "Docker Essentials",
            "zh": "Docker 基础"
          },
          "description": {
            "en": "Container management, image building, Docker Compose, networking and volumes",
            "zh": "容器管理、镜像构建、Docker Compose、网络与卷"
          },
          "importance": "required",
          "tags": ["docker", "container", "devops"]
        }
      ]
    },
    {
      "id": "cloud-cli-basics",
      "name": {
        "en": "Cloud CLI Basics",
        "zh": "云 CLI 基础"
      },
      "level": "beginner",
      "description": {
        "en": "Basic command-line interfaces for major cloud providers",
        "zh": "主流云厂商命令行工具基础"
      },
      "items": [
        {
          "id": "aws-cli-basics",
          "name": {
            "en": "AWS CLI Basics",
            "zh": "AWS CLI 基础"
          },
          "description": {
            "en": "Manage AWS Lightsail and EC2 via AWS CLI; basic CloudWatch monitoring",
            "zh": "通过 AWS CLI 管理 Lightsail / EC2；基础 CloudWatch 监控"
          },
          "importance": "recommended",
          "tags": ["aws", "cloud", "cli"]
        },
        {
          "id": "azure-cli-basics",
          "name": {
            "en": "Azure CLI Basics",
            "zh": "Azure CLI 基础"
          },
          "description": {
            "en": "Chat-based Azure infrastructure assistance using Azure CLI and portal",
            "zh": "使用 Azure CLI 与门户进行基础基础设施管理"
          },
          "importance": "recommended",
          "tags": ["azure", "cloud", "cli"]
        },
        {
          "id": "tencent-cloud-lighthouse",
          "name": {
            "en": "Tencent Cloud Lighthouse",
            "zh": "腾讯云 Lighthouse"
          },
          "description": {
            "en": "Manage Tencent Cloud Lighthouse servers and basic networking",
            "zh": "管理腾讯云轻量应用服务器及基础网络"
          },
          "importance": "recommended",
          "tags": ["tencent-cloud", "lighthouse", "china"]
        }
      ]
    },
    {
      "id": "cicd-basics",
      "name": {
        "en": "CI/CD Basics",
        "zh": "CI/CD 基础"
      },
      "level": "beginner",
      "description": {
        "en": "Introduction to continuous integration and delivery pipelines",
        "zh": "持续集成与交付流水线入门"
      },
      "items": [
        {
          "id": "github-actions",
          "name": {
            "en": "GitHub Actions",
            "zh": "GitHub Actions"
          },
          "description": {
            "en": "CI/CD workflows, Docker builds, security scanning, and matrix builds",
            "zh": "CI/CD 工作流、Docker 构建、安全扫描与矩阵构建"
          },
          "importance": "required",
          "tags": ["cicd", "github", "automation"]
        }
      ]
    },
    {
      "id": "observability-basics",
      "name": {
        "en": "Observability Basics",
        "zh": "可观测性基础"
      },
      "level": "beginner",
      "description": {
        "en": "Basic monitoring, logging, and health checking",
        "zh": "基础监控、日志与健康检查"
      },
      "items": [
        {
          "id": "service-health-check",
          "name": {
            "en": "Service Health Check",
            "zh": "服务健康检查"
          },
          "description": {
            "en": "Monitor VPS/server health metrics including CPU, RAM, disk, and Docker status",
            "zh": "监控 VPS/服务器健康指标（CPU、内存、磁盘、Docker 状态）"
          },
          "importance": "required",
          "tags": ["monitoring", "health", "sysadmin"]
        },
        {
          "id": "log-parser",
          "name": {
            "en": "Log Parser",
            "zh": "日志解析"
          },
          "description": {
            "en": "Parse JSON, Nginx, and Apache logs with natural-language anomaly analysis",
            "zh": "解析 JSON、Nginx、Apache 日志并用自然语言分析异常"
          },
          "importance": "recommended",
          "tags": ["logging", "analysis", "troubleshooting"]
        }
      ]
    }
  ],
  "ecosystemMappings": {
    "claw": [
      {
        "skillId": "docker-essentials",
        "externalId": "docker-skill",
        "externalName": "Docker Essentials",
        "externalUrl": "https://clawhub.ai/skills/docker-essentials",
        "confidence": 0.95,
        "notes": "Also maps to dacker and agentic-devops"
      },
      {
        "skillId": "aws-cli-basics",
        "externalId": "awscli",
        "externalName": "AWS CLI",
        "externalUrl": "https://clawhub.ai/skills/awscli",
        "confidence": 0.9,
        "notes": "Covers aws-infra and aws-ecs-monitor basics"
      },
      {
        "skillId": "github-actions",
        "externalId": "github-actions-templates",
        "externalName": "GitHub Actions Templates",
        "externalUrl": "https://clawhub.ai/skills/github-actions-templates",
        "confidence": 0.95,
        "notes": "CI/CD workflow skill from wshobson/agents"
      },
      {
        "skillId": "service-health-check",
        "externalId": "server-health-agent",
        "externalName": "Server Health Agent",
        "externalUrl": "https://clawhub.ai/skills/server-health-agent",
        "confidence": 0.85,
        "notes": "Also related to service-watchdog"
      },
      {
        "skillId": "log-parser",
        "externalId": "log-parse-skill",
        "externalName": "Log Parse Skill",
        "externalUrl": "https://clawhub.ai/skills/log-parse-skill",
        "confidence": 0.9,
        "notes": "NLP-based log analysis"
      }
    ],
    "skillhub": [
      {
        "skillId": "tencent-cloud-lighthouse",
        "externalId": "tencentcloud-lighthouse-skill",
        "externalName": "腾讯云 Lighthouse",
        "externalUrl": "https://skillhub.tencent.com/skills/tencentcloud-lighthouse-skill",
        "confidence": 0.95,
        "notes": "Tencent Cloud Lighthouse management skill"
      }
    ]
  }
}
