{
  "version": "1.0.0",
  "role": "developer",
  "specialization": "general",
  "metadata": {
    "title": {
      "en": "Intermediate Developer Skills",
      "zh": "中级开发者技能"
    },
    "description": {
      "en": "Skills for developers with 1-3 years of experience",
      "zh": "适合有 1-3 年经验的开发者"
    },
    "lastUpdated": "2026-04-01"
  },
  "skills": [
    {
      "id": "software-design",
      "name": {
        "en": "Software Design and Architecture",
        "zh": "软件设计与架构"
      },
      "level": "intermediate",
      "items": [
        {
          "id": "oop",
          "name": {
            "en": "Object-Oriented Programming",
            "zh": "面向对象编程"
          },
          "description": {
            "en": "Understanding encapsulation, inheritance, polymorphism, and abstraction",
            "zh": "理解封装、继承、多态和抽象"
          },
          "importance": "required",
          "tags": ["design", "oop"]
        },
        {
          "id": "design-patterns",
          "name": {
            "en": "Design Patterns",
            "zh": "设计模式"
          },
          "description": {
            "en": "Applying common patterns like Singleton, Factory, Observer, Strategy",
            "zh": "应用常见模式如单例、工厂、观察者、策略"
          },
          "importance": "required",
          "tags": ["design", "patterns"]
        },
        {
          "id": "solid",
          "name": {
            "en": "SOLID Principles",
            "zh": "SOLID 原则"
          },
          "description": {
            "en": "Implementing Single Responsibility, Open/Closed, Liskov Substitution, Interface Segregation, Dependency Inversion",
            "zh": "实践单一职责、开闭、里氏替换、接口隔离、依赖反转原则"
          },
          "importance": "required",
          "tags": ["design", "principles"]
        }
      ]
    },
    {
      "id": "testing",
      "name": {
        "en": "Testing and Quality Assurance",
        "zh": "测试与质量保证"
      },
      "level": "intermediate",
      "items": [
        {
          "id": "unit-testing",
          "name": {
            "en": "Unit Testing",
            "zh": "单元测试"
          },
          "description": {
            "en": "Writing focused tests for individual functions/methods",
            "zh": "为单个函数/方法编写专注的测试"
          },
          "importance": "required",
          "tags": ["testing", "unit"]
        },
        {
          "id": "tdd",
          "name": {
            "en": "Test-Driven Development (TDD)",
            "zh": "测试驱动开发 (TDD)"
          },
          "description": {
            "en": "Writing tests before implementing functionality",
            "zh": "在实现功能之前编写测试"
          },
          "importance": "recommended",
          "tags": ["testing", "tdd"]
        },
        {
          "id": "integration-testing",
          "name": {
            "en": "Integration Testing",
            "zh": "集成测试"
          },
          "description": {
            "en": "Verifying interactions between different modules/components",
            "zh": "验证不同模块/组件之间的交互"
          },
          "importance": "required",
          "tags": ["testing", "integration"]
        }
      ]
    },
    {
      "id": "databases",
      "name": {
        "en": "Databases and Data Management",
        "zh": "数据库和数据管理"
      },
      "level": "intermediate",
      "items": [
        {
          "id": "sql",
          "name": {
            "en": "SQL Proficiency",
            "zh": "SQL 熟练度"
          },
          "description": {
            "en": "Writing complex queries with joins, subqueries, aggregations",
            "zh": "编写包含连接、子查询、聚合的复杂查询"
          },
          "importance": "required",
          "tags": ["database", "sql"]
        },
        {
          "id": "database-design",
          "name": {
            "en": "Database Design",
            "zh": "数据库设计"
          },
          "description": {
            "en": "Creating normalized schemas with appropriate relationships",
            "zh": "创建具有适当关系的规范化模式"
          },
          "importance": "required",
          "tags": ["database", "design"]
        },
        {
          "id": "orm",
          "name": {
            "en": "ORM Usage",
            "zh": "ORM 使用"
          },
          "description": {
            "en": "Working with Object-Relational Mapping tools (Hibernate, SQLAlchemy, Prisma)",
            "zh": "使用对象关系映射工具（Hibernate、SQLAlchemy、Prisma）"
          },
          "importance": "recommended",
          "tags": ["database", "orm"]
        }
      ]
    }
  ]
}
